{
  "scenarioId": "orbital_system_1",
  "name": "Orbital System 1",
  "comboVisible": false,
  "source": "OrbitalSystem.ts",
  "bodies": [
    {
      "isActive": true,
      "mass": 100,
      "position": {
        "x": -3,
        "y": 0
      },
      "velocity": {
        "x": 0,
        "y": 10
      }
    },
    {
      "isActive": true,
      "mass": 100,
      "position": {
        "x": -1,
        "y": 0
      },
      "velocity": {
        "x": 0,
        "y": 10
      }
    },
    {
      "isActive": true,
      "mass": 100,
      "position": {
        "x": 1,
        "y": 0
      },
      "velocity": {
        "x": 0,
        "y": 10
      }
    },
    {
      "isActive": true,
      "mass": 100,
      "position": {
        "x": 3,
        "y": 0
      },
      "velocity": {
        "x": 0,
        "y": 10
      }
    }
  ]
}