{
  "scenarioId": "sun_planet_comet",
  "name": "Sun, Planet, Comet",
  "comboVisible": true,
  "source": "OrbitalSystem.ts",
  "bodies": [
    {
      "isActive": true,
      "mass": 200,
      "position": {
        "x": 0,
        "y": 0
      },
      "velocity": {
        "x": 0,
        "y": 0
      }
    },
    {
      "isActive": true,
      "mass": 1,
      "position": {
        "x": 1.5,
        "y": 0
      },
      "velocity": {
        "x": 0,
        "y": 25.3467
      }
    },
    {
      "isActive": true,
      "mass": 1e-06,
      "position": {
        "x": -2.2,
        "y": 1.3
      },
      "velocity": {
        "x": -4.2244,
        "y": -7.3928
      }
    }
  ]
}